{
  "schema_version": "2.0.0",
  "assessment_id": "pipeline-integrity:synthetic-predictor:v1",
  "research_id": "research:ofi-reversion",
  "research_version": "1",
  "created_at": "2026-09-01T10:00:00Z",
  "updated_at": "2026-09-01T12:30:00Z",
  "status": "PLANNED",
  "plan_locked_at": "2026-09-01T10:15:00Z",
  "first_run_at": null,
  "outcome_contract_ref": "outcome-contract:ofi-reversion:v1",
  "pipeline_fingerprint_ref": "fingerprint:synthetic-predictor:v1",
  "pipeline_fingerprint_sha256": "a89aa3ad8fefca04926b497564263bf185db363b87d00909ca3b772aec7ab52d",
  "complete_pipeline_rerun": true,
  "causal_tooling_required": false,
  "validation_data_unseen": true,
  "controls": [
    {
      "control_id": "control:null-session-surrogates",
      "purpose": "NULL_NEGATIVE_CONTROL",
      "related_research_element_ref": null,
      "required_for_gate": true,
      "basis": "SYNTHETIC_MODEL",
      "empirical_data_role": "NOT_APPLICABLE",
      "empirical_dataset_ref": null,
      "model": {
        "family": "CUSTOM",
        "specification": "Independent seeded replications of paired uniform disturbances; optional fixed shift.",
        "parameter_provenance": "Toy interface constants fixed before execution, not fitted to any market data.",
        "code_or_method_ref": "method:session-preserving-null:v1",
        "random_seed_policy": "The complete unique seed list is frozen below; no retries or seed selection.",
        "preserved_structure": [
          "AUTOCORRELATION"
        ],
        "unpreserved_relevant_structure": [],
        "structure_adequacy": "ADEQUATE_FOR_PURPOSE"
      },
      "expected_truth": {
        "effect_state": "NO_EFFECT",
        "direction": "NONE",
        "timing_rule": "Full 32-value replication; no market timing claim.",
        "construction_basis": "Paired bounded disturbances with zero or fixed positive shift in an explicitly synthetic reference world."
      },
      "planned_runs": 200,
      "actual_runs": 0,
      "acceptance_rule": {
        "locked_before_first_run": true,
        "decision_rule": "PASS only within the frozen numeric detection-rate interval and standard-error limit.",
        "target_precision": "Independent Bernoulli standard error at most 0.036.",
        "minimum_runs": 200,
        "maximum_standard_error": 0.036,
        "minimum_run_rationale": "Retained 200-run floor bounds worst-case independent Bernoulli standard error by sqrt(0.25/200), approximately 0.03536. This is interface precision, not proof of a null model or market validity.",
        "pass_rate_min": 0,
        "pass_rate_max": 0.1
      },
      "result": {
        "status": "NOT_ASSESSED",
        "evidence_refs": [],
        "monte_carlo_uncertainty": "Not executed.",
        "uncertainty_record": null,
        "plain_language_interpretation": "No execution result exists."
      },
      "permitted_consequence": "PIPELINE_GATE_ONLY",
      "seeds": [
        0,
        1,
        2,
        3,
        4,
        5,
        6,
        7,
        8,
        9,
        10,
        11,
        12,
        13,
        14,
        15,
        16,
        17,
        18,
        19,
        20,
        21,
        22,
        23,
        24,
        25,
        26,
        27,
        28,
        29,
        30,
        31,
        32,
        33,
        34,
        35,
        36,
        37,
        38,
        39,
        40,
        41,
        42,
        43,
        44,
        45,
        46,
        47,
        48,
        49,
        50,
        51,
        52,
        53,
        54,
        55,
        56,
        57,
        58,
        59,
        60,
        61,
        62,
        63,
        64,
        65,
        66,
        67,
        68,
        69,
        70,
        71,
        72,
        73,
        74,
        75,
        76,
        77,
        78,
        79,
        80,
        81,
        82,
        83,
        84,
        85,
        86,
        87,
        88,
        89,
        90,
        91,
        92,
        93,
        94,
        95,
        96,
        97,
        98,
        99,
        100,
        101,
        102,
        103,
        104,
        105,
        106,
        107,
        108,
        109,
        110,
        111,
        112,
        113,
        114,
        115,
        116,
        117,
        118,
        119,
        120,
        121,
        122,
        123,
        124,
        125,
        126,
        127,
        128,
        129,
        130,
        131,
        132,
        133,
        134,
        135,
        136,
        137,
        138,
        139,
        140,
        141,
        142,
        143,
        144,
        145,
        146,
        147,
        148,
        149,
        150,
        151,
        152,
        153,
        154,
        155,
        156,
        157,
        158,
        159,
        160,
        161,
        162,
        163,
        164,
        165,
        166,
        167,
        168,
        169,
        170,
        171,
        172,
        173,
        174,
        175,
        176,
        177,
        178,
        179,
        180,
        181,
        182,
        183,
        184,
        185,
        186,
        187,
        188,
        189,
        190,
        191,
        192,
        193,
        194,
        195,
        196,
        197,
        198,
        199
      ],
      "generator": {
        "file": {
          "path": "../scripts/synthetic_control_generator.py",
          "sha256": "5fa87b84978186a7237a8062fd52b593a702457262c255962977073eb069afc4"
        },
        "configuration": {
          "effect": 0
        }
      }
    },
    {
      "control_id": "control:known-effect-sentinel",
      "purpose": "POSITIVE_SENTINEL",
      "related_research_element_ref": null,
      "required_for_gate": true,
      "basis": "SYNTHETIC_MODEL",
      "empirical_data_role": "NOT_APPLICABLE",
      "empirical_dataset_ref": null,
      "model": {
        "family": "CUSTOM",
        "specification": "Independent seeded replications of paired uniform disturbances; optional fixed shift.",
        "parameter_provenance": "Toy interface constants fixed before execution, not fitted to any market data.",
        "code_or_method_ref": "method:known-effect-sentinel:v1",
        "random_seed_policy": "The complete unique seed list is frozen below; no retries or seed selection.",
        "preserved_structure": [
          "AUTOCORRELATION"
        ],
        "unpreserved_relevant_structure": [],
        "structure_adequacy": "ADEQUATE_FOR_PURPOSE"
      },
      "expected_truth": {
        "effect_state": "KNOWN_EFFECT",
        "direction": "POSITIVE",
        "timing_rule": "Full 32-value replication; no market timing claim.",
        "construction_basis": "Paired bounded disturbances with zero or fixed positive shift in an explicitly synthetic reference world."
      },
      "planned_runs": 200,
      "actual_runs": 0,
      "acceptance_rule": {
        "locked_before_first_run": true,
        "decision_rule": "PASS only within the frozen numeric detection-rate interval and standard-error limit.",
        "target_precision": "Independent Bernoulli standard error at most 0.036.",
        "minimum_runs": 200,
        "maximum_standard_error": 0.036,
        "minimum_run_rationale": "Retained 200-run floor bounds worst-case independent Bernoulli standard error by sqrt(0.25/200), approximately 0.03536. This is interface precision, not proof of a null model or market validity.",
        "pass_rate_min": 0.9,
        "pass_rate_max": 1
      },
      "result": {
        "status": "NOT_ASSESSED",
        "evidence_refs": [],
        "monte_carlo_uncertainty": "Not executed.",
        "uncertainty_record": null,
        "plain_language_interpretation": "No execution result exists."
      },
      "permitted_consequence": "PIPELINE_GATE_ONLY",
      "seeds": [
        1000,
        1001,
        1002,
        1003,
        1004,
        1005,
        1006,
        1007,
        1008,
        1009,
        1010,
        1011,
        1012,
        1013,
        1014,
        1015,
        1016,
        1017,
        1018,
        1019,
        1020,
        1021,
        1022,
        1023,
        1024,
        1025,
        1026,
        1027,
        1028,
        1029,
        1030,
        1031,
        1032,
        1033,
        1034,
        1035,
        1036,
        1037,
        1038,
        1039,
        1040,
        1041,
        1042,
        1043,
        1044,
        1045,
        1046,
        1047,
        1048,
        1049,
        1050,
        1051,
        1052,
        1053,
        1054,
        1055,
        1056,
        1057,
        1058,
        1059,
        1060,
        1061,
        1062,
        1063,
        1064,
        1065,
        1066,
        1067,
        1068,
        1069,
        1070,
        1071,
        1072,
        1073,
        1074,
        1075,
        1076,
        1077,
        1078,
        1079,
        1080,
        1081,
        1082,
        1083,
        1084,
        1085,
        1086,
        1087,
        1088,
        1089,
        1090,
        1091,
        1092,
        1093,
        1094,
        1095,
        1096,
        1097,
        1098,
        1099,
        1100,
        1101,
        1102,
        1103,
        1104,
        1105,
        1106,
        1107,
        1108,
        1109,
        1110,
        1111,
        1112,
        1113,
        1114,
        1115,
        1116,
        1117,
        1118,
        1119,
        1120,
        1121,
        1122,
        1123,
        1124,
        1125,
        1126,
        1127,
        1128,
        1129,
        1130,
        1131,
        1132,
        1133,
        1134,
        1135,
        1136,
        1137,
        1138,
        1139,
        1140,
        1141,
        1142,
        1143,
        1144,
        1145,